{
  "$schema": "http://json-schema.org/draft-04/schema#",
  "type": "object",
  "properties": {
    "batches": {
      "type": "array",
      "items": {}
    },
    "curricula": {
      "type": "array",
      "items": {}
    },
    "trainers": {
      "type": "array",
      "items": {}
    },
    "skills": {
      "type": "array",
      "items": [
        {
          "type": "object",
          "properties": {
            "id": {
              "type": "integer"
            },
            "name": {
              "type": "string"
            },
            "tags": {
              "type": "array",
              "items": [
                {
                  "type": "string"
                },
                {
                  "type": "string"
                },
                {
                  "type": "string"
                }
              ]
            }
          },
          "required": ["id", "name", "tags"]
        }
      ]
    },
    "locations": {
      "type": "array",
      "items": {}
    },
    "buildings": {
      "type": "array",
      "items": {}
    },
    "rooms": {
      "type": "array",
      "items": {}
    },
    "projects": {
      "type": "array",
      "items": {}
    },
    "settings": {
      "type": "array",
      "items": {}
    }
  },
  "required": [
    "batches",
    "curricula",
    "trainers",
    "skills",
    "locations",
    "buildings",
    "rooms",
    "projects",
    "settings"
  ]
}
